paper_id,paper_citation,category,subcategory,tool,usage
25,"(Makani and Jangampeta, 2021)",Security,Container Security,Aqua Security,"Performs vulnerability scanning, compliance checks, and runtime protection in containerized environments."
25,"(Makani and Jangampeta, 2021)",Security,Dependency and Container Scanning,Snyk,Identifies and automatically fixes vulnerabilities in open-source dependencies and container images.
25,"(Makani and Jangampeta, 2021)",Security,Dynamic Application Security Testing (DAST),OWASP ZAP,Simulates real-world attacks on running applications to uncover runtime vulnerabilities.
25,"(Makani and Jangampeta, 2021)",Security,Secrets Vaulting and Access Control,HashiCorp Vault,Manages access to secrets like API keys and credentials with fine-grained control and secure storage.
26,"(Mińón et al., 2022)",AI & Machine Learning,Infrastructure Automation,Pangea,"Automatically generates infrastructure templates for edge, fog, and cloud layers. Simplifies deployment and configuration of analytic pipelines using declarative models."
26,"(Mińón et al., 2022)",AI & Machine Learning,Pipeline Deployment,Pangea,"Supports end-to-end deployment of machine learning pipelines across distributed environments. Handles data ingestion, preprocessing, model training, and deployment in DevOps/MLOps workflows."
26,"(Mińón et al., 2022)",AI & Machine Learning,Environment Configuration,Pangea,"Generates infrastructure-as-code scripts to configure environments for ML applications without manual intervention, supporting repeatable and scalable operations."
26,"(Mińón et al., 2022)",AI & Machine Learning,Cross-Layer Orchestration,Pangea,"Facilitates orchestration of ML services across edge, fog, and cloud layers, enabling efficient resource utilization and adaptive deployment strategies in DevOps contexts."
27,"(Mishra and Sharma, 2025)",Code Quality & Analysis,Repository Mining,V-Git-Lab,Python-Flask based tool to generate software defect prediction datasets from GitHub repositories using metrics.
27,"(Mishra and Sharma, 2025)",Code Quality & Analysis,Public Repositories,GitHub,Used to crawl and extract code metrics for building defect prediction datasets.
27,"(Mishra and Sharma, 2025)",Code Quality & Analysis,Machine Learning Models,MLP,Multi-Layer Perceptron model used in predicting software defects from extracted GitHub data.
27,"(Mishra and Sharma, 2025)",Code Quality & Analysis,Deep Learning Models,DNN,Deep Neural Network used to enhance defect prediction in DevOps pipeline.
28,"(Narang and Mittal, 2022)",Build & CI/CD,CI Server,Jenkins,"Popular open-source automation server with a large plugin ecosystem, used to build and integrate code changes continuously."
28,"(Narang and Mittal, 2022)",Build & CI/CD,CI Server,TeamCity,Commercial CI server known for ease of use and strong IDE integration; supports on-premises hosting.
28,"(Narang and Mittal, 2022)",Build & CI/CD,CI Server,Buildbot,"Open-source framework for automating software build, test, and release processes; highly customizable."
28,"(Narang and Mittal, 2022)",Testing & Quality Assurance,Test Automation,Selenium,Open-source tool for automating web browsers; supports multiple programming languages and platforms.
28,"(Narang and Mittal, 2022)",Testing & Quality Assurance,Performance Testing,JMeter,Open-source tool designed for load testing and measuring performance of web applications.
28,"(Narang and Mittal, 2022)",Testing & Quality Assurance,Functional Testing,TestComplete,"Commercial automated UI testing tool for desktop, web, and mobile applications; supports multiple scripting languages."
28,"(Narang and Mittal, 2022)",Build & CI/CD,CI/CD Platform,GitLab,"Web-based DevOps lifecycle tool providing Git repository management, CI/CD pipelines, and monitoring capabilities."
28,"(Narang and Mittal, 2022)",Build & CI/CD,CI/CD Platform,GitHub Actions,"Automation platform integrated into GitHub repositories, enabling custom CI/CD workflows."
28,"(Narang and Mittal, 2022)",Build & CI/CD,CI/CD Platform,Azure DevOps,"Cloud-based service providing version control, build automation, release pipelines, and project management."
28,"(Narang and Mittal, 2022)",Build & CI/CD,Configuration Management,Ansible,"Open-source automation tool for configuration management, application deployment, and orchestration."
28,"(Narang and Mittal, 2022)",Build & CI/CD,Configuration Management,Puppet,Configuration management tool for automating infrastructure provisioning and management.
28,"(Narang and Mittal, 2022)",Build & CI/CD,Configuration Management,Chef,Automation platform for configuring and managing infrastructure using code.
28,"(Narang and Mittal, 2022)",Continuous Monitoring,Monitoring & Alerting,Nagios,"Open-source monitoring tool for infrastructure, network, and applications; provides alerting features."
28,"(Narang and Mittal, 2022)",Continuous Monitoring,Monitoring & Alerting,Sensu,Monitoring solution for dynamic environments; integrates with various alerting and incident response tools.
28,"(Narang and Mittal, 2022)",Continuous Monitoring,Log Management & Analysis,Splunk,"Commercial platform for searching, monitoring, and analyzing machine-generated big data."
28,"(Narang and Mittal, 2022)",Build & CI/CD,Continuous Integration and Deployment,Jenkins,"Automates build, testing, and deployment in a hybrid DevOps model; used as the backbone of pipeline execution integrated with multiple plugins."
28,"(Narang and Mittal, 2022)",Build & CI/CD,Testing and Build Reporting,JUnit Plugin,Jenkins plugin used to generate and display test reports after build execution in the hybrid model pipeline.
28,"(Narang and Mittal, 2022)",Build & CI/CD,Code Quality Assurance,Cobertura Plugin,"Plugin used in Jenkins to assess code coverage during pipeline execution, ensuring sufficient testing depth."
28,"(Narang and Mittal, 2022)",Build & CI/CD,Static Code Analysis,Checkstyle Plugin,Analyzes source code style and reports warnings; integrated into Jenkins for improving code quality.
28,"(Narang and Mittal, 2022)",Build & CI/CD,Post-Build Actions,Email Extension Plugin,Used in Jenkins to send email notifications regarding the build results to the development team.
28,"(Narang and Mittal, 2022)",Build & CI/CD,CI Pipeline Orchestration,Jenkins,"Used to orchestrate automated CI/CD pipelines for building, testing, and deploying applications; integrated with Git, Maven, and Selenium."
28,"(Narang and Mittal, 2022)",Source Code & Version Control,Version Control,Git,"Facilitates distributed version control, collaboration, and change tracking across multiple contributors."
28,"(Narang and Mittal, 2022)",Build & CI/CD,Project Build Tool,Maven,"Handles project builds, dependency management, and documentation generation in Java-based projects."
28,"(Narang and Mittal, 2022)",Testing & Quality Assurance,Automated Testing,Selenium,"Used for automated testing of web applications, ensuring functionality across browsers and platforms."
28,"(Narang and Mittal, 2022)",Analytics & Monitoring,Application Monitoring,New Relic,"Tracks application performance, response time, and user interactions to identify bottlenecks and issues."
28,"(Narang and Mittal, 2022)",Analytics & Monitoring,Log Management,Splunk,Analyzes log data from various environments to deliver real-time insights and troubleshooting support.
29,"(Palihawadana et al., 2017)",Requirement Engineering & Tracking,End-to-End Artifact Tracking,SAT Analyzer,"Supports traceability across DevOps stages including requirement, design, code, test, configuration, and deployment. Provides dashboards, visualizations, and semi-automated trace link generation."
29,"(Palihawadana et al., 2017)",Requirement Engineering & Tracking,CI Integration,SAT Analyzer,Integrates with Jenkins to generate trace links for build jobs and test executions as part of DevOps pipelines.
29,"(Palihawadana et al., 2017)",Requirement Engineering & Tracking,Visualization and Graph Analysis,SAT Analyzer,Uses Neo4j and Gephi to provide graph-based visualization of traceability links between software artifacts.
29,"(Pastrana Pardo et al., 2021)",Build & CI/CD,Deployment Automation,Spinnaker,Multi-cloud continuous delivery platform used to automate software deployment and manage release pipelines.
29,"(Pastrana Pardo et al., 2021)",Analytics & Monitoring,Metrics Collection,Prometheus,Monitoring system and time series database used for collecting metrics and triggering alerts.
29,"(Pastrana Pardo et al., 2021)",Analytics & Monitoring,Tracing and Visualization,Grafana,Visualization tool used to monitor application performance by displaying time-series data from Prometheus and other sources.
29,"(Pastrana Pardo et al., 2021)",Application Deployment & Orchestration,Container Orchestration,Kubernetes,Manages containerized application deployment and scaling across clusters.
30,"(Patchamatla and Owolabi, 2025)",Machine Learning Deployment,CI/CD Tools,Kubeflow Pipelines,Supports building and deploying ML workflows using Kubernetes; includes versioning and reproducibility for ML tasks.
30,"(Patchamatla and Owolabi, 2025)",Machine Learning Deployment,CI/CD Tools,MLflow,"Open-source platform for managing the ML lifecycle, including experimentation, reproducibility, and deployment pipelines."
30,"(Patchamatla and Owolabi, 2025)",Machine Learning Deployment,CI/CD Tools,TensorFlow Extended (TFX),"Production-ready ML pipeline framework supporting model validation, training, and serving using TensorFlow ecosystem."
30,"(Patchamatla and Owolabi, 2025)",Build & CI/CD,Automation Pipelines,Jenkins,Widely-used automation server for integrating and deploying ML workflows via plugins and scripted pipelines.
30,"(Patchamatla and Owolabi, 2025)",Containerization & Orchestration,Workflow Management,Argo Workflows,"Kubernetes-native engine for running complex ML workflows as DAGs, supporting scalable deployment and automation."
31,"(Patchamatla, 2024)",AI & Machine Learning,Hyperparameter Tuning,Optuna,Used to optimize hyperparameters during model training with integration into CI/CD pipelines for continuous experimentation.
31,"(Patchamatla, 2024)",Build & CI/CD,Pipeline Automation,GitHub Actions,Automates hyperparameter tuning workflows by orchestrating training jobs with tools like Optuna.
31,"(Patchamatla, 2024)",Containerization & Orchestration,Isolated Execution,Docker,Ensures consistent environment setup for ML training and tuning in CI/CD workflows.
32,"(Petrovi et al., 2022)",Cloud Infrastructure & IaC,Code Quality & Security Inspection,Checkov,"Static code analysis for IaC including Terraform, CloudFormation, Kubernetes, Serverless, ARM templates."
32,"(Petrovi et al., 2022)",Cloud Infrastructure & IaC,Code Linting,Super-Linter,Combines various linters in GitHub workflows to check multiple languages and formats.
32,"(Petrovi et al., 2022)",Cloud Infrastructure & IaC,Multi-language Linting,Mega-Linter,Analyzes quality and consistency for 47+ languages and 22+ formats with auto-fixes and reporting.
32,"(Petrovi et al., 2022)",Security,Dependency Vulnerability Scanning,Snyk,"Finds and fixes vulnerabilities in software dependencies from ecosystems like npm, Maven, PyPI."
32,"(Petrovi et al., 2022)",Cloud Infrastructure & IaC,Security Checking for Terraform,tfsec,Performs static analysis of Terraform code to detect potential security issues.
32,"(Petrovi et al., 2022)",Cloud Infrastructure & IaC,Security Checking for Terraform,terrascan,Scans Terraform code to ensure compliance with security best practices.
32,"(Petrovi et al., 2022)",Cloud Infrastructure & IaC,Security Checking for Ansible,Steampunk Spotter,Scans Ansible content for quality and security vulnerabilities.
32,"(Petrovi et al., 2022)",DevOps Platforms & Tools,Secrets Detection,git-secrets,Prevents committing passwords and other sensitive information to Git.
32,"(Petrovi et al., 2022)",DevOps Platforms & Tools,Secrets Detection,git-leaks,"Scans repositories for secrets like passwords, API keys, and credentials."
32,"(Petrovi et al., 2022)",DevOps Platforms & Tools,Code Statistics,cloc,Counts lines of code and distinguishes between different file types in IaC archives.
33,"(Poonam and Mittal, 2019)",Collaboration & Project Management,Agile Planning and Workflow,JIRA,"Selected as the best tool for project management automation based on weighted evaluation criteria. Supports customizable workflows, issue tracking, agile boards, and detailed progress tracking."
33,"(Poonam and Mittal, 2019)",Collaboration & Project Management,Lightweight Task Boards,Trello,Evaluated for project planning and task management; supports simple kanban-style boards and prioritization.
33,"(Poonam and Mittal, 2019)",Collaboration & Project Management,Lean Portfolio Management,LeanKit,Used for visualizing work across teams; assessed for workload distribution and managing dependencies.
33,"(Poonam and Mittal, 2019)",Collaboration & Project Management,Enterprise Planning,AgileCraft,Analyzed for its support in strategic planning and agile execution at scale; integrates with lower-level agile tools.
33,"(Poonam and Mittal, 2019)",Build & CI/CD,Automation Server,Jenkins,"Supports CI/CD pipelines for building, testing, and deploying applications; widely used in DevOps automation setups."
33,"(Poonam and Mittal, 2019)",Build & CI/CD,Build and Deployment,Bamboo,Build server for continuous integration; integrates with Atlassian tools for DevOps automation.
33,"(Poonam and Mittal, 2019)",Testing & Quality Assurance,Functional Testing,Selenium,Used for browser-based automated functional testing; suitable for DevOps pipelines.
33,"(Poonam and Mittal, 2019)",Testing & Quality Assurance,Performance Testing,JMeter,Open-source tool for load testing and measuring application performance under stress.
33,"(Poonam and Mittal, 2019)",Collaboration & Project Management,Collaboration Wiki,Confluence,Used for collaborative documentation and linking technical and project management information.
33,"(Poonam and Mittal, 2019)",Source Code & Version Control,Source Control,Bitbucket,Provides Git-based source code management; integrates with Atlassian DevOps tools.
33,"(Poonam and Mittal, 2019)",Source Code & Version Control,Peer Review Tools,Crucible,Supports collaborative code reviews in an enterprise DevOps environment.
33,"(Poonam and Mittal, 2019)",Analytics & Monitoring,Log and Event Analysis,Splunk,"Used for operational intelligence, log aggregation, and security event monitoring."
33,"(Poonam and Mittal, 2019)",Requirement Engineering & Tracking,Knowledge Base,Slite,Assessed as a modern documentation and requirement capture tool in DevOps settings.
33,"(Poonam and Mittal, 2019)",Requirement Engineering & Tracking,Team Knowledge Sharing,Notion,Utilized for requirement documentation and lightweight project collaboration.
33,"(Poonam and Mittal, 2019)",Requirement Engineering & Tracking,Wiki System,MediaWiki,Explored as an open-source wiki for managing requirements and technical documentation.
33,"(Poonam and Mittal, 2019)",Requirement Engineering & Tracking,Documentation Platform,BookStack,Tool for structuring and presenting requirements in a hierarchical documentation format.
33,"(Poonam and Mittal, 2019)",Source Code & Version Control,Git Hosting,GitLab,Self-hosted Git repository management solution with integrated CI/CD and DevOps features.
33,"(Poonam and Mittal, 2019)",Source Code & Version Control,Distributed VCS,GitHub,Popular code repository and collaboration platform widely used in DevOps pipelines.
33,"(Poonam and Mittal, 2019)",Source Code & Version Control,Code Hosting,Launchpad,Open-source platform for hosting and managing software projects and versioned code.
33,"(Poonam and Mittal, 2019)",Build & CI/CD,Continuous Integration,TeamCity,Build management and CI server offering test reporting and artifact archiving.
33,"(Poonam and Mittal, 2019)",Security,DAST,ZAP,Used for dynamic security testing of web applications in the DevSecOps pipeline.
33,"(Poonam and Mittal, 2019)",Testing & Quality Assurance,GUI Test Automation,TestComplete,"Commercial automated testing tool supporting UI and functional testing of desktop, mobile, and web apps."
33,"(Poonam and Mittal, 2019)",Testing & Quality Assurance,Functional Testing,UFT,Enterprise-grade functional testing tool used for automating user interface tests across platforms.
34,"(Prates and Pereira, 2025)",Security,Static Code Security Testing,SonarQube,"Used in DevSecOps pipelines to scan source code for bugs, vulnerabilities, and code smells during development, enabling early detection of security issues."
34,"(Prates and Pereira, 2025)",Security,Dynamic Application Security Testing (DAST),OWASP ZAP,"Performs real-time security scanning of running web applications to detect vulnerabilities like injection flaws, XSS, and broken authentication."
34,"(Prates and Pereira, 2025)",Security,Software Composition Analysis (SCA),OWASP Dependency Check,Analyzes third-party libraries and dependencies in projects to identify known vulnerabilities using public CVE databases.
34,"(Prates and Pereira, 2025)",Cloud Infrastructure & IaC,Security Policy Validation,Checkov,"Scans infrastructure-as-code configurations (e.g., Terraform) to ensure compliance with security policies and detect misconfigurations before deployment."
34,"(Prates and Pereira, 2025)",Application Deployment & Orchestration,CI/CD Automation,GitLab CI,Manages the end-to-end CI/CD pipeline and integrates DevSecOps tools for automated security checks at every stage of development and deployment.
35,"(Radhakrishnan et al., 2024)",Data Management & Mining,Statistical Computing,R,"Open-source language and environment for statistical computing and graphics, widely used in engineering data analysis and visualization."
35,"(Radhakrishnan et al., 2024)",Data Management & Mining,Scientific Programming,Python,"Popular programming language for sustainable engineering analysis, offering extensive open-source libraries for data manipulation, visualization, and modeling."
35,"(Radhakrishnan et al., 2024)",Visualization & Reporting,Interactive Graphing,Plotly,"Python-based library used for interactive, publication-quality data visualizations in engineering and research domains."
35,"(Radhakrishnan et al., 2024)",AI & Machine Learning,Workflow Automation,KNIME,"Graphical tool for automating data science workflows; supports drag-and-drop analysis pipelines integrating ML, ETL, and reporting tasks."
35,"(Radhakrishnan et al., 2024)",Analytics & Monitoring,Big Data Infrastructure,Apache Spark,"Open-source unified analytics engine used for large-scale data processing, real-time streaming, and machine learning integration in smart computing systems."
36,"(Raghunathan, 2020)",Security,Static Code Security Testing,SonarQube,"Performs static code analysis in CI/CD to detect bugs, vulnerabilities, and code smells."
36,"(Raghunathan, 2020)",Security,Static Code Security Testing,Brakeman,Performs static security analysis for Ruby on Rails applications.
36,"(Raghunathan, 2020)",Security,Software Composition Analysis (SCA),Dependency-Check,Scans dependencies against the NVD to detect known vulnerabilities.
36,"(Raghunathan, 2020)",Security,Software Composition Analysis (SCA),Snyk,Monitors and remediates vulnerabilities in open-source dependencies.
36,"(Raghunathan, 2020)",Containerization & Orchestration,Vulnerability Scanning,Clair,Scans container images for known vulnerabilities.
36,"(Raghunathan, 2020)",Containerization & Orchestration,Vulnerability Scanning,Trivy,Scans containers and file systems for security flaws and misconfigurations.
36,"(Raghunathan, 2020)",Cloud Infrastructure & IaC,IaC Scanning,TerraScan,Scans Terraform and Kubernetes IaC files for misconfigurations.
36,"(Raghunathan, 2020)",Cloud Infrastructure & IaC,IaC Scanning,Checkov,"Performs static code analysis of Terraform, CloudFormation, and Kubernetes configurations."
36,"(Raghunathan, 2020)",Security,Dynamic Application Security Testing (DAST),OWASP ZAP,Performs dynamic security testing of running web applications.
36,"(Raghunathan, 2020)",Security,Credential Storage,HashiCorp Vault,"Manages access to secrets, passwords, and sensitive information."
36,"(Raghunathan, 2020)",Containerization & Orchestration,Configuration Audit,Neuvector,Applies Kubernetes CIS Benchmarks for auditing configuration.
36,"(Raghunathan, 2020)",Containerization & Orchestration,Configuration Audit,kube-bench,Audits Kubernetes clusters against CIS benchmarks.
36,"(Raghunathan, 2020)",Security,Intrusion Detection,Falco,Performs real-time threat detection and runtime security monitoring in containers.
36,"(Raghunathan, 2020)",Security,Artifact Integrity,in-toto,Secures software supply chain by ensuring artifact integrity and traceability.
36,"(Raghunathan, 2020)",Security,Image Signing,Notary,Signs and verifies Docker container images.
36,"(Raghunathan, 2020)",Security,Kubernetes Integration,External Secrets Operator,Syncs Kubernetes secrets with external secret management tools.
36,"(Raghunathan, 2020)",Cloud Infrastructure & IaC,Provisioning,Terraform,Defines and provisions infrastructure through code.
36,"(Raghunathan, 2020)",Configuration & Dependency Management,Automation,Ansible,Automates software provisioning and configuration management.
36,"(Raghunathan, 2020)",Security,Cloud-Based,AWS Secrets Manager,"Stores and retrieves sensitive data like database credentials, API keys, etc."
36,"(Raghunathan, 2020)",Security,Cloud-Based,Azure Key Vault,"Manages secrets, keys, and certificates in Azure."
36,"(Raghunathan, 2020)",Containerization & Orchestration,CNI and Policy Enforcement,Cilium,Implements network security policies and observability in Kubernetes using eBPF.
36,"(Raghunathan, 2020)",Containerization & Orchestration,Policy Management,Calico,Enforces network security policies for Kubernetes clusters.
37,"(Rajapakse et al., 2021)",Security,Static Code Security Testing,SonarQube,Static analysis tool integrated into CI/CD pipelines; widely adopted for scanning source code for bugs and vulnerabilities during development.
37,"(Rajapakse et al., 2021)",Security,Software Composition Analysis (SCA),OWASP Dependency-Check,Tool used to identify vulnerable dependencies in software projects; commonly integrated with build tools like Maven and Gradle.
37,"(Rajapakse et al., 2021)",Security,Dynamic Application Security Testing (DAST),OWASP ZAP,Dynamic security scanner for detecting runtime vulnerabilities in web applications; noted for use in pipeline integration during QA or staging.
37,"(Rajapakse et al., 2021)",Security,Container Image Scanning,Clair,"Static vulnerability scanner for Docker and container images, used in CI/CD to detect known issues in base images before deployment."
37,"(Rodriguez et al., 2017)",Application Deployment & Orchestration,Continuous Integration and Deployment,Jenkins,"Used for automating build, test, and deployment pipelines in modern DevOps workflows for web applications."
37,"(Rodriguez et al., 2017)",Source Code & Version Control,Source Code Management,Git,"Handles versioning of application source code; supports branching, merging, and collaboration across teams."
37,"(Rodriguez et al., 2017)",Containerization & Orchestration,Application Packaging,Docker,Encapsulates web applications in containers to ensure consistent deployment across environments.
37,"(Rodriguez et al., 2017)",Analytics & Monitoring,System Monitoring,Nagios,Used for monitoring servers and network components to detect failures and bottlenecks in DevOps environments.
37,"(Rodriguez et al., 2017)",Cloud Infrastructure & IaC,Cloud Hosting and Automation,Amazon Web Services (AWS),Provides scalable cloud infrastructure for hosting web applications integrated with CI/CD and container tools.
37,"(Rodriguez et al., 2017)",Networking & Automation,Configuration Management,Chef,Manages and automates infrastructure configuration and deployment in DevOps-based systems.
38,"(Roy et al., 2021)",Requirement Engineering & Tracking,Requirement Prioritization,CARO,CARO is a conflict-aware requirement ordering tool that generates an optimal prioritization order among functional and non-functional requirements by analyzing their conflicts and dependencies. It helps mitigate risks during incremental software delivery in DevOps.
38,"(Roy et al., 2021)",Requirement Engineering & Tracking,Risk Assessment,CARO,Provides dynamic risk analysis by comparing optimal and alternate requirement orderings. Enables developers to understand and manage risks when selected features neglect dependencies or conflicts.
38,"(Roy et al., 2021)",Requirement Engineering & Tracking,Traceability,CARO,Allows tracking of implemented features and their associated requirements. Supports unfreezing of features to reduce risk when conflicts or dependencies are unresolved.
38,"(Roy et al., 2021)",Requirement Engineering & Tracking,Dashboard Monitoring,CARO,"Includes a dashboard to monitor project progress, changes, and risk estimations in each iteration of development."
39,"(Rubasinghe et al., 2021)",Requirement Engineering & Tracking,Traceability Management,SAT-Analyser,"A traceability management tool that supports requirement-to-code and test traceability across the DevOps lifecycle. Provides dashboards, impact analysis, and version control tracking to ensure trace coverage and minimize defects."
39,"(Rubasinghe et al., 2021)",Requirement Engineering & Tracking,Change Impact Analysis,SAT-Analyser,Allows developers to visualize how changes in requirements affect code and test cases; supports early defect detection and risk analysis in agile and DevOps workflows.
39,"(Rubasinghe et al., 2021)",Visualization & Reporting,Dashboard Monitoring,SAT-Analyser,"Presents traceability data through interactive dashboards, enabling team members to monitor requirement satisfaction and coverage across DevOps stages."
